{"beta_binomial":[{"confidence95_wilson":[0.0,1.0],"credible95":[0.025,0.975],"k":0,"mle":0.0,"n":0,"p_gt_half":0.5,"post":[1,1],"post_mean":0.5,"post_sd":0.2886751346,"prior":[1,1]},{"confidence95_wilson":[0.1077912674,0.6032218525],"credible95":[0.1092634438,0.6097425596],"k":3,"mle":0.3,"n":10,"p_gt_half":0.11328125,"post":[4,8],"post_mean":0.3333333333,"post_sd":0.1307440901,"prior":[1,1]},{"confidence95_wilson":[0.1811918241,0.5671457233],"credible95":[0.1810716255,0.5696754829],"k":7,"mle":0.35,"n":20,"p_gt_half":0.0946235657,"post":[8,14],"post_mean":0.3636363636,"post_sd":0.1003049608,"prior":[1,1]},{"confidence95_wilson":[0.2189488529,0.3958485463],"credible95":[0.2189787263,0.3961471286],"k":30,"mle":0.3,"n":100,"p_gt_half":2.76654e-05,"post":[31,71],"post_mean":0.3039215686,"post_sd":0.0453201394,"prior":[1,1]},{"confidence95_wilson":[0.1176207742,0.7692757187],"credible95":[0.0943903273,0.7905833359],"k":2,"mle":0.4,"n":5,"p_gt_half":0.3302347274,"post":[2.5,3.5],"post_mean":0.4166666667,"post_sd":0.1863389981,"prior":[0.5,0.5]},{"confidence95_wilson":[0.1381200911,0.6093779111],"credible95":[0.1128094039,0.4716598277],"k":4,"mle":0.3333333333,"n":12,"p_gt_half":0.0133018494,"post":[6,16],"post_mean":0.2727272727,"post_sd":0.0928643488,"prior":[2,8]},{"confidence95_wilson":[0.5312991224,0.8881382986],"credible95":[0.4574518924,0.7039496805],"k":15,"mle":0.75,"n":20,"p_gt_half":0.9037367711,"post":[35,25],"post_mean":0.5833333333,"post_sd":0.0631230331,"prior":[20,20]},{"confidence95_wilson":[0.0,0.2775327999],"credible95":[0.0022989722,0.2849141529],"k":0,"mle":0.0,"n":10,"p_gt_half":0.0004882813,"post":[1,11],"post_mean":0.0833333333,"post_sd":0.0766555176,"prior":[1,1]},{"confidence95_wilson":[0.7224672001,1.0],"credible95":[0.7150858471,0.9977010278],"k":10,"mle":1.0,"n":10,"p_gt_half":0.9995117188,"post":[11,1],"post_mean":0.9166666667,"post_sd":0.0766555176,"prior":[1,1]},{"confidence95_wilson":[0.257167672,0.3466372458],"credible95":[0.261303119,0.350256026],"k":120,"mle":0.3,"n":400,"p_gt_half":0.0,"post":[125,285],"post_mean":0.3048780488,"post_sd":0.0227076749,"prior":[5,5]}],"coverage":{"credible_average_over_uniform_prior":0.952336,"credible_beta_2_8_prior":[0.924516,0.956826,0.978489,0.963238,0.868392],"credible_uniform_prior":[0.924516,0.956826,0.956328,0.975218,0.958611],"n":20,"p":[0.05,0.1,0.2,0.3,0.5],"wilson_confidence":[0.924516,0.956826,0.956328,0.975218,0.958611]},"generated_at":"2026-10-11T00:00:00Z","normal_normal":[{"confidence95_z":[-0.5530450812,2.9530450812],"credible95":[-0.6399759897,1.973309323],"n":5,"post_mean":0.6666666667,"post_sd":0.6666666667,"prior":[0,1],"sigma":2,"ybar":1.2},{"confidence95_z":[-0.5530450812,2.9530450812],"credible95":[-0.5555985049,2.9365508858],"n":5,"post_mean":1.1904761905,"post_sd":0.8908708064,"prior":[0,10],"sigma":2,"ybar":1.2},{"confidence95_z":[104.1601440618,119.8398559382],"credible95":[103.6281767732,118.778462231],"n":25,"post_mean":111.2033195021,"post_sd":3.8649397584,"prior":[100,15],"sigma":20,"ybar":112},{"confidence95_z":[104.1601440618,119.8398559382],"credible95":[101.1951741981,113.4389721434],"n":25,"post_mean":107.3170731707,"post_sd":3.1234752378,"prior":[100,5],"sigma":20,"ybar":112},{"confidence95_z":[33.1601440618,48.8398559382],"credible95":[34.9622558119,49.5205028088],"n":4,"post_mean":42.2413793103,"post_sd":3.7139067635,"prior":[50,10],"sigma":8,"ybar":41},{"confidence95_z":[0.1040036015,0.4959963985],"credible95":[0.1020059974,0.4920534086],"n":100,"post_mean":0.297029703,"post_sd":0.099503719,"prior":[0,1],"sigma":1,"ybar":0.3},{"confidence95_z":[8.1201080464,19.8798919536],"credible95":[7.9691920103,14.4923464512],"n":1,"post_mean":11.2307692308,"post_sd":1.6641005887,"prior":[10,2],"sigma":3,"ybar":14},{"confidence95_z":[-1.7929519122,-0.4070480878],"credible95":[-1.8049895088,-0.4244678555],"n":50,"post_mean":-1.1147286822,"post_sd":0.3521803625,"prior":[-3,4],"sigma":2.5,"ybar":-1.1}],"schema_version":"v1","sequential":{"flips":[0,0,1,0,0,0,0,0,0,1,0,1,0,0,0,0,0,1,0,0,1,1,0,0,0,0,0,0,0,0,0,1,0,0,0,1,0,0,0,1,0,1,1,0,0,0,1,0,1,0,0,0,0,0,0,0,0,1,0,1,0,0,0,0,0,0,0,0,0,0,1,1,0,1,0,1,0,0,1,0,0,1,0,0,0,0,1,0,1,0,0,0,1,0,0,1,0,0,1,0,0,1,1,1,1,0,0,1,0,1,0,0,0,1,0,1,0,1,1,0,0,0,0,1,1,0,0,0,1,0,0,0,0,1,0,0,0,1,0,0,0,0,0,1,0,1,0,0,1,0,1,0,0,0,1,0,0,0,0,0,0,0,0,0,0,0,0,0,0,0,0,0,0,0,0,0,0,0,0,1,1,0,1,0,0,0,1,0,0,0,1,0,0,1,1,0,1,1,1,0],"p_true":0.3,"path":[{"ci_hi":0.7934506856227626,"ci_lo":0.0,"cr_hi":0.841886116991581,"cr_lo":0.012579117093425018,"k":0,"mean":0.3333333333333333,"n":1},{"ci_hi":0.6576197724933469,"ci_lo":0.0,"cr_hi":0.707598226178713,"cr_lo":0.00840375865961264,"k":0,"mean":0.25,"n":2},{"ci_hi":0.7923403991979522,"ci_lo":0.06149194472039621,"cr_hi":0.8058795503167562,"cr_lo":0.06758598648854305,"k":1,"mean":0.4,"n":3},{"ci_hi":0.6993581574175981,"ci_lo":0.04558726080970055,"cr_hi":0.7164179361180893,"cr_lo":0.05274495052631682,"k":1,"mean":0.3333333333333333,"n":4},{"ci_hi":0.6244653702374747,"ci_lo":0.03622410863243014,"cr_hi":0.6412345789976748,"cr_lo":0.043271868292741586,"k":1,"mean":0.2857142857142857,"n":5},{"ci_hi":0.5635028221864702,"ci_lo":0.030053369748306635,"cr_hi":0.5787231970431952,"cr_lo":0.03669256617608552,"k":1,"mean":0.25,"n":6},{"ci_hi":0.5131278292743189,"ci_lo":0.02567962434474355,"cr_hi":0.5265096708752064,"cr_lo":0.03185402624994424,"k":1,"mean":0.2222222222222222,"n":7},{"ci_hi":0.4708881822128535,"ci_lo":0.02241749145005667,"cr_hi":0.4824965149173369,"cr_lo":0.02814497347789819,"k":1,"mean":0.2,"n":8},{"ci_hi":0.434999705576656,"ci_lo":0.019890887638544907,"cr_hi":0.4450161170281951,"cr_lo":0.025210726326833376,"k":1,"mean":0.18181818181818182,"n":9},{"ci_hi":0.5098375284633583,"ci_lo":0.05668215145437519,"cr_hi":0.5177558523601722,"cr_lo":0.06021773417290674,"k":2,"mean":0.25,"n":10},{"ci_hi":0.45185448715169363,"ci_lo":0.07047549346981563,"cr_hi":0.456456546231612,"cr_lo":0.072662038252882,"k":3,"mean":0.23529411764705882,"n":15},{"ci_hi":0.41601743225189364,"ci_lo":0.08065766257979806,"cr_hi":0.4190660411835275,"cr_lo":0.08217587559302275,"k":4,"mean":0.22727272727272727,"n":20},{"ci_hi":0.4342968335542908,"ci_lo":0.11496313693401444,"cr_hi":0.43647509694138653,"cr_lo":0.11573221329150399,"k":6,"mean":0.25925925925925924,"n":25},{"ci_hi":0.3730569641314825,"ci_lo":0.0950510717728987,"cr_hi":0.3747321661065842,"cr_lo":0.095942168345751,"k":6,"mean":0.21875,"n":30},{"ci_hi":0.3589161306566562,"ci_lo":0.10042446473798625,"cr_hi":0.36024801617502555,"cr_lo":0.10115053034491261,"k":7,"mean":0.21621621621621623,"n":35},{"ci_hi":0.37503096742310027,"ci_lo":0.12316091323540743,"cr_hi":0.3761374654340023,"cr_lo":0.12363248839584429,"k":9,"mean":0.23809523809523808,"n":40},{"ci_hi":0.3867338005702035,"ci_lo":0.1423547943377172,"cr_hi":0.3876689101140708,"cr_lo":0.1426685368882311,"k":11,"mean":0.2553191489361702,"n":45},{"ci_hi":0.39553157264848837,"ci_lo":0.15871527493552393,"cr_hi":0.3963342169440739,"cr_lo":0.15892726538641488,"k":13,"mean":0.2692307692307692,"n":50},{"ci_hi":0.3634836618916773,"ci_lo":0.14366655869733186,"cr_hi":0.36418425165083657,"cr_lo":0.1439331121643972,"k":13,"mean":0.24561403508771928,"n":55},{"ci_hi":0.37232070077047824,"ci_lo":0.15776522530056675,"cr_hi":0.3729407034981419,"cr_lo":0.15796059753603625,"k":15,"mean":0.25806451612903225,"n":60},{"ci_hi":0.3464470914814666,"ci_lo":0.1451383484616103,"cr_hi":0.3469981019771776,"cr_lo":0.14536832649814718,"k":15,"mean":0.23880597014925373,"n":65},{"ci_hi":0.3239118626347889,"ci_lo":0.1343870301710779,"cr_hi":0.3244026609056524,"cr_lo":0.13464028224874314,"k":15,"mean":0.2222222222222222,"n":70},{"ci_hi":0.3477876614910298,"ci_lo":0.1575487366000292,"cr_hi":0.3482393636658977,"cr_lo":0.15771837956503898,"k":18,"mean":0.24675324675324675,"n":75},{"ci_hi":0.3548467461923397,"ci_lo":0.16806231857542375,"cr_hi":0.35526021044181155,"cr_lo":0.16819753663753656,"k":20,"mean":0.25609756097560976,"n":80},{"ci_hi":0.34834552725485807,"ci_lo":0.1676462116157798,"cr_hi":0.3487253537506724,"cr_lo":0.16777747881313076,"k":21,"mean":0.25287356321839083,"n":85},{"ci_hi":0.3543764898755346,"ci_lo":0.17674759373369173,"cr_hi":0.3547275955806716,"cr_lo":0.17685483487497067,"k":23,"mean":0.2608695652173913,"n":90},{"ci_hi":0.34844561297970755,"ci_lo":0.17604541982403177,"cr_hi":0.3487714112767081,"cr_lo":0.17615088995900013,"k":24,"mean":0.25773195876288657,"n":95},{"ci_hi":0.3537098944918718,"ci_lo":0.18404698464748132,"cr_hi":0.3540134457815175,"cr_lo":0.18413494592794571,"k":26,"mean":0.2647058823529412,"n":100},{"ci_hi":0.37848335867998717,"ci_lo":0.2080712457182028,"cr_hi":0.3787650375953434,"cr_lo":0.2081188145383101,"k":30,"mean":0.2897196261682243,"n":105},{"ci_hi":0.38169344863821325,"ci_lo":0.21423583339556446,"cr_hi":0.38195695452172373,"cr_lo":0.2142747822076816,"k":32,"mean":0.29464285714285715,"n":110},{"ci_hi":0.3754601708656285,"ci_lo":0.21222580601277446,"cr_hi":0.3757086925144283,"cr_lo":0.2122679089768295,"k":33,"mean":0.2905982905982906,"n":115},{"ci_hi":0.38715142432473576,"ci_lo":0.2252562422427457,"cr_hi":0.3873839369956934,"cr_lo":0.22528233450844293,"k":36,"mean":0.30327868852459017,"n":120},{"ci_hi":0.38948432483385975,"ci_lo":0.23020330949980428,"cr_hi":0.38970355445139127,"cr_lo":0.23022459765865722,"k":38,"mean":0.30708661417322836,"n":125},{"ci_hi":0.38358810626948486,"ci_lo":0.22789251820828765,"cr_hi":0.38379660418988004,"cr_lo":0.2279172602645005,"k":39,"mean":0.30303030303030304,"n":130},{"ci_hi":0.3780944643813028,"ci_lo":0.2257702568110221,"cr_hi":0.37829310556404805,"cr_lo":0.2257978734040919,"k":40,"mean":0.29927007299270075,"n":135},{"ci_hi":0.3729628573555679,"ci_lo":0.22381542565461754,"cr_hi":0.37315242404498805,"cr_lo":0.2238454336804181,"k":41,"mean":0.29577464788732394,"n":140},{"ci_hi":0.3681580296307527,"ci_lo":0.22200992166912484,"cr_hi":0.36833922276914055,"cr_lo":0.22204191643824478,"k":42,"mean":0.2925170068027211,"n":145},{"ci_hi":0.37062349175928394,"ci_lo":0.2263642092461876